,Blurb#,Blurb
0,1,"

Give me use cases for the importance of great online security?

What are some key steps I can take to secure my company?

What are some key steps I can take to secure my company?"
1,2,"

Some features of great online security are that it is comprehensive and easy to use. In addition, it should be continuously upgraded to make sure that it can keep up with the latest technologies.

What is the difference between a network security system and a firewall?

A network security system protects your entire network while a firewall protects only one computer.

Is an Internet Service Provider (ISP) responsible for securing its customers’ data?

Yes. The ISP needs to"
2,3,"

Online security is important for many reasons, especially when it comes to your teens. Teens are at greater risk for cyber bullying, fraud, identity theft and much more. If you have a teen that is using the Internet then you need to provide them with security awareness training, information about online fraud, and tips on how they can ensure their online activity is safe.

What do we offer?

For parents of children who use our service we offer a safe and secure environment where"
3,4,"

• It will be easy for them to know about your business and trust you.

• It keeps all the sensitive information safe from hackers.

• It keeps your data controlled only with you, even if you lose or break your device, you can access it from anywhere.

• You should always keep your app updated so that it will be compatible with the latest changes in the technology.

What is an advantage of using a cloud-based platform?

•"
4,5,"

The first thing to do is to get the best antivirus software. There are a lot of antivirus programs out there, but only few stand out from the crowd and offer great protection for your computer system. The one that I would recommend for you is Bitdefender Internet Security. It offers security for all the devices you use and provides multiple layers of protection against cyber threats. It offers an Anti-Phishing module, which blocks access to phishing websites and protects your online transactions;"
